status,parameter_path,condition_id,mapped_prior_id,mission_type,study_doi,study_slug,endpoint_definition,numerator,denominator,person_days,events,exposure_time,repeated_measure_structure,extraction_quote,extractor,verifier,risk_of_bias,transportability,transformation,uncertainty_distribution,model_version,acceptance_version,prior_value_hash,notes
accepted,conditions.behavioral-emergency.incidence.alpha,behavioral-emergency,behavioral-emergency,leo-iss,10.3357/ASEM.3612.2013,S20_walton_kerstman_2020_iss_quantification,Gamma-Poisson incidence shape (alpha) for behavioral emergency,,,,,,Diego Malpica,Diego Malpica,low,moderate,none,Gamma(2),imm-v1,2026-06-pilot-1,d4735e3a265e16ee,Pilot adjudication batch 1: tierA-nasa K15 anchor; maps imm-priors.json alpha=2
accepted,conditions.behavioral-emergency.incidence.beta,behavioral-emergency,behavioral-emergency,leo-iss,10.3357/ASEM.3612.2013,S20_walton_kerstman_2020_iss_quantification,Gamma-Poisson incidence rate (beta person-days) for behavioral emergency,,,,,,Diego Malpica,Diego Malpica,low,moderate,none,Gamma(400000),imm-v1,2026-06-pilot-1,ad1e2e29fe1631dd,Pilot adjudication batch 1: tierA-nasa K15 anchor; maps imm-priors.json beta=400000
accepted,conditions.acute-sinusitis.incidence.alpha,acute-sinusitis,acute-sinusitis,leo-iss,10.3357/amhp.4343.2015,M18_myers_2018_imm_validation,Gamma-Poisson incidence shape (alpha) for acute sinusitis,,,,,,Diego Malpica,Diego Malpica,low,high,none,Gamma(2),imm-v1,2026-06-pilot-1,d4735e3a265e16ee,Pilot adjudication batch 1: tierA-nasa IMM validation table
accepted,conditions.acute-sinusitis.incidence.beta,acute-sinusitis,acute-sinusitis,leo-iss,10.3357/amhp.4343.2015,M18_myers_2018_imm_validation,Gamma-Poisson incidence rate (beta person-days) for acute sinusitis,,,,,,Diego Malpica,Diego Malpica,low,high,none,Gamma(204),imm-v1,2026-06-pilot-1,fc56dbc6d4652b31,Pilot adjudication batch 1: tierA-nasa IMM validation table
proposal,conditions.behavioral-emergency.severity.worst_case_prob_alpha,behavioral-emergency,behavioral-emergency,analog-controlled,,rev3-f-notes,Proposal severity shape pending full analog outcome registry,,,,,,Diego Malpica,,moderate,low,none,Beta(1.5),imm-v1,,,Queued for batch 2 adjudication after analog outcome extraction
